{
  "$schema": "https://json-schema.org/draft/2020-12/schema",
  "$id": "https://afterimage.local/schemas/analysis.schema.json",
  "title": "Afterimage Analysis Sidecar",
  "type": "object",
  "required": ["id", "assetId", "probe", "sceneCuts"],
  "properties": {
    "id": { "$ref": "https://afterimage.local/schemas/shared-defs.schema.json#/$defs/idString" },
    "assetId": { "$ref": "https://afterimage.local/schemas/shared-defs.schema.json#/$defs/idString" },
    "probe": { "$ref": "https://afterimage.local/schemas/shared-defs.schema.json#/$defs/probeMetadata" },
    "sceneCuts": {
      "type": "array",
      "items": { "$ref": "https://afterimage.local/schemas/shared-defs.schema.json#/$defs/sceneCut" },
      "default": []
    },
    "thumbnails": {
      "type": "array",
      "items": { "$ref": "https://afterimage.local/schemas/shared-defs.schema.json#/$defs/thumbnailReference" },
      "default": []
    },
    "waveform": { "$ref": "https://afterimage.local/schemas/shared-defs.schema.json#/$defs/waveformSummary" },
    "audioChangeTrack": { "$ref": "https://afterimage.local/schemas/shared-defs.schema.json#/$defs/audioChangeTrack" },
    "syncEventTrack": { "$ref": "https://afterimage.local/schemas/shared-defs.schema.json#/$defs/syncEventTrack" },
    "beatTrack": { "$ref": "https://afterimage.local/schemas/shared-defs.schema.json#/$defs/beatTrack" },
    "midiGestureTrack": { "$ref": "https://afterimage.local/schemas/shared-defs.schema.json#/$defs/midiGestureTrack" },
    "luma": { "$ref": "https://afterimage.local/schemas/shared-defs.schema.json#/$defs/lumaSummary" },
    "motion": { "$ref": "https://afterimage.local/schemas/shared-defs.schema.json#/$defs/motionSummary" },
    "summary": { "$ref": "https://afterimage.local/schemas/shared-defs.schema.json#/$defs/analysisSummary" }
  },
  "additionalProperties": false
}
